Easting,Northing,n,n_serious,locations
520025.0009,302074.9999,1,0,HAREBELL CLOSE OUTSIDE NO 40 PETERBOROUGH
520025.0009,302124.9999,1,0,HAREBELL CLOSE OUTSIDE NO 36 PETERBOROUGH
520025.0009,302274.9999,1,0,A47 EYE RD JUNCTION A15 PETERBOROUGH
520075.0009,296274.9999,1,0,A1139 FRANK PERKINS PARKWAY NO GRID REF PROVIDED
520075.0009,296924.9999,1,0,A1139 FRANK PERKINS PARKWAY 500M NORTH OF A605 WHITTLESEY RD
520075.0009,297074.9999,1,0,SOUTH STREET OUTSIDE NO 10 PETERBOROUGH
520075.0009,298774.9999,1,0,STAR RD 5M SOUTH ATKINSON ST PETERBOROUGH
520075.0009,298924.9999,1,0,STAR RD NR STAR MEWS PETERBOROUGH
520075.0009,301074.9999,1,1,90 CHESTNUT AVENUE OCATION
520075.0009,302274.9999,1,0,A47 EYE RD JUNCTION A15 RDABT OVER PASTON PARKWAY
520125.0009,260274.9999,1,0,BELLAND RD SIDE ARCH WAY NEAR JUNCTION CAMBRIDGE RD
520125.0009,275424.9999,1,0,WESTBOUND A14 600 METRES EAST OF JUNCTION WITH ALCONBURY B10
520125.0009,294524.9999,1,0,B1091 BROADWAY OUTSIDE NO 12 YAXLEY
520125.0009,294574.9999,1,0,40 BROADWAY
520125.0009,296324.9999,1,0,A1139 FLETTON PARKWAY PETERBOROUGH
520125.0009,298474.9999,1,0,POTTERS WAY JW MILLER WAY PETERBOROUGH
520125.0009,299024.9999,1,0,STAR RD BURTON ST PETERBOROUGH
520125.0009,299074.9999,1,0,STAR RD EASTGATE PETERBOROUGH OUTSIDE NO 157
520125.0009,299124.9999,1,0,STAR RD PETERBOROUGH EXACT LOCATION UNKNOWN
520125.0009,299174.9999,1,0,STAR RD NR STAR CLOSE PETERBOROUGH
520125.0009,299224.9999,1,0,STAR RD 100M SOUTH OF PADHOLME RD PETERBOROUGH
520125.0009,301624.9999,1,0,EASTERN AVE JUNCTION MYRTLE AVE PETERBOROUGH
520125.0009,302374.9999,1,0,A47 PETERBOROUGH RD EXACT LOC UNKNOWN
520125.0009,302424.9999,1,0,NEWBOROUGH RD JUNCTION A47 MAIN WISBECH RD PETERBOROUGH
520175.0009,271224.9999,1,0,MILLER WAY NO24
520175.0009,271524.9999,1,0,THRAPSTON RD 5M WEST OF LAWS CRESCENT BRAMPTON
520175.0009,275324.9999,1,0,A14 EBC ALCONBURY
520175.0009,294974.9999,1,0,PETERBOROUGH ROAD B1091  OUTSIDE NO 36
520175.0009,295074.9999,1,0,B1091 PETERBOROUGH RD FARCET OUTSIDE NO 52 AND 54
520175.0009,295224.9999,1,0,B1091 PETERBOROUGH RD OUTSIDE NO 107 PETERBOROUGH
520175.0009,296374.9999,1,0,A1139 FLETTON PARKWAY JUST SOUTH OF FLY OVER WHITTLESEY RD
520175.0009,296424.9999,1,0,STANGROUND BYPASS A605 EXACT LOCATION UNKNOWN. PLOTTED ON BR
520175.0009,296624.9999,1,0,FLETTON PARKWAY A1139 AT JN WITH A605
520175.0009,296924.9999,1,0,ALDI WHITTLESEY ROAD
520175.0009,297224.9999,1,0,CHAPEL ST OS NO 16 STANGROUND
520175.0009,298624.9999,1,0,A1139 FRANK PERKINS PARKWAY 300M SOUTH OF BOONGATE
520175.0009,299274.9999,1,0,STAR ROAD OUTSIDE NO 208 PETERBOROUGH
520175.0009,299974.9999,1,1,C51 EASTFIELD RD 75M NORTH OF BROADWAY PETERBOROUGH
520175.0009,301574.9999,1,0,OUTSIDE 264 EASTERN AVENUE
520175.0009,304524.9999,1,0,GUNTONS RD JUNCTION BRIDGEHILL RD PETERBOROUGH
520175.0009,304674.9999,1,1,C49 GUNTONS RD 0.1 MILE NORTH FROM BRIDGEHILL RD PETERBOROUG
520225.0009,294624.9999,1,0,PETERBOROUGH ROAD FARCET JUNCTION MAIN ST
520225.0009,295324.9999,1,0,PETERBOROUGH RD EXACT LOC NOT KNOWN NO GRID REF GIVEN
520225.0009,295924.9999,1,0,PETERBOROUGH RD STANGROUND AT NO 251
520225.0009,296024.9999,1,0,EXIT ROAD FROM STANGROUND COLLEGE PETERBOROUGH ROAD
520225.0009,296124.9999,1,0,B1091 OS STANGROUND COLLEGE PETERBOROUGH
520225.0009,296474.9999,1,0,SLIP RD FROM SBC OF PERKINS PARKWAY JUNCTION WHITTLESEY RD
520225.0009,296824.9999,1,0,WHITTLESEY ROAD A605 BY ZEBRA CROSSING O/S ALDI 100M NORTH O
520225.0009,297024.9999,1,0,SOUTH ST  AT JCT  TUCKERS YARD PETERBOROUGH
520225.0009,298574.9999,1,0,BISHOPS RD JUNCTION POTTERS WAY PETERBOROUGH
520225.0009,298624.9999,1,0,A1139 FRANK PERKINS PARKWAY PETERBOROUGH
520225.0009,298674.9999,1,0,A1139 500M WEST OF BOONGATE
520225.0009,299174.9999,1,0,BOONGATE 150M WEST OF A1139 ROUNDABOUT PETERBOROUGH
520225.0009,299324.9999,1,0,PADHOLME RD OUTSIDE NO 174 JUNCTION PARK LANE PETERBOROUGH
520225.0009,299474.9999,1,0,SAXON RD OS NO 32 JNCT CHESTER RD PETERBOROUGH
520225.0009,300074.9999,1,0,C51 EASTFIELD RD JUNCTION COLLEGE PARK PETERBOROUGH
520225.0009,300824.9999,1,0,SYCAMORE AVE JUNCTION HAWTHORN RD PETERBOROUGH
520225.0009,301274.9999,1,0,LILAC RD OS NO 24 PETERBOROUGH
520225.0009,301474.9999,1,1,CENTRAL AVENUE
520225.0009,302424.9999,1,0,A47 70M E OF NEWBOROUGH RD PETERBOROUGH
520225.0009,304974.9999,1,0,C49 GUNTONS RD NEAR TO BLEMONT COTTAGES NEWBOROUGH
520275.0009,255774.9999,1,0,C174 DREWELS LANE NR EYNESBURY HARDWICK
520275.0009,260274.9999,1,1,STONE HILL OUTSIDE NO 21 ST NEOTS
520275.0009,267474.9999,1,0,MILL ROAD BUCKDEN
520275.0009,294624.9999,1,0,MAIN ST JUNCTION MANOR CLOSE FARCETT
520275.0009,296074.9999,1,0,OS NO 281 STANGROUND SCHOOL ENTRANCE PETERBOROUGH ROAD
520275.0009,296124.9999,1,0,B1091 PETERBOROUGH RD NEAR STANGROUND COLLEGE
520275.0009,296224.9999,1,0,B1091 PETERBOROUGH RD PETERBOROUGH
520275.0009,296424.9999,1,0,B1091 PETERBOROUGH RD JUNCTION A605 WHITTLESEY RD STANGROUND
520275.0009,296674.9999,1,0,A605 WHITTLESEY RD 65M SOUTHEAST OF SOUTH ST RDABT
520275.0009,296874.9999,1,1,SOUTH ST OUTSIDE NO 75 PETERBOROUGH
520275.0009,296924.9999,1,0,SOUTH STREET
520275.0009,298724.9999,1,0,A1139 FRANK PERKINS PARKWAY 150 YDS S OF SLIP RD PBORO
520275.0009,299024.9999,1,0,BURTON COURT PETERBOROUGH
520275.0009,299624.9999,1,0,FLAG FEN RD JUNCTION SAXON RD PETERBOROUGH
520275.0009,299774.9999,1,0,NORMAN RD OS NO 70 JNCT REEVES WAY PETERBOROUGH
520275.0009,300174.9999,1,1,C51 EASTFIELD RD OS 308 PETERBOROUGH
520275.0009,300824.9999,1,0,SYCAMORE AVE OUTSIDE NO 80 PETERBOROUGH
520275.0009,305374.9999,1,0,MIDDLE RD JUNCTION GUNTONS RD NEWBOROUGH
520275.0009,305474.9999,1,0,C49 GUNTONS RD OUTSIDE 96 NEWBOROUGH PETERBOROUGH
520325.0009,260924.9999,1,0,GREAT HIGH GROUND LOVES FARM ST NEOTS
520325.0009,271474.9999,1,1,THRAPSTON ROAD NEAR A14
520325.0009,279674.9999,1,0,MONKS WOOD HOUSE MONKS WOOD RD WOODWALTON HUNTINGDON
520325.0009,296374.9999,1,0,B1091 PETERBOROUGH RD 40M SOUTH OF WHITTLESEY RD PETERBOROUG
520325.0009,298824.9999,1,0,FRANK PERKINS PARKWAY A1139 WB BOONGATE
520325.0009,300224.9999,1,1,C51 EASTFIELD RD JUNCTION WHEATSHEAF PUBLIC HOUSE
520325.0009,302374.9999,1,0,A47 EYE BY PASS 100M WEST OF WELLARD RD A16 ROUNDABOUT
520325.0009,305624.9999,1,0,GUNTONS ROAD 30 METRES SOUTH OF QUORNS CLOSE AT TRAFFIC CALM
520375.0009,270924.9999,1,0,WEST END BRAMPTON OUTSIDE NO 14 HUNTINGDON
520375.0009,296424.9999,1,0,WHITTLESEY ROAD ROUNDABOUT WHITTLESEY ROAD A605
520375.0009,297324.9999,1,1,38 THISTLE DRIVE UNSPECIFIED ROAD OR LOCATION
520375.0009,298474.9999,1,0,HARVESTER WAY JUNCTION FENGATE PETERBOROUGH
520375.0009,298524.9999,1,0,FENGATE RD OUTSIDE 61 PETERBOROUGH
520375.0009,299724.9999,1,0,OUTSIDE NUMBER 49 SAXON ROAD
520375.0009,300274.9999,1,0,C51 EASTFIELD RD AT PETROL STAT EXIT NR ASHCROFT GDNS
520375.0009,301624.9999,1,0,SCALFORD DRIVE TOWARDS POPLAR AVENUE
520375.0009,302424.9999,1,0,EYE RD A47 DUAL CWAY PETERBOROUGH  JUST BEFORE A16 RBT
520375.0009,306074.9999,1,0,GUNTONS ROAD PAST JUNCTION WITH SOKE ROAD
520425.0009,270874.9999,1,1,PARK ROAD BRAMPTON
520425.0009,271524.9999,1,1,A14 EBC BRAMPTON ADJ TO OFF SLIP B1514 THRAPSTON RD
520425.0009,295474.9999,1,0,NUMBER11 FAUNA WAY
520425.0009,296974.9999,1,0,CONEYGREE RD JUNCTION AYRES DRIVE PETERBOROUGH
520425.0009,298974.9999,1,0,BOONGATE UNSPECIFIED ROAD OR LOCATION BOONGATE/FRANK PERKINS
520425.0009,299074.9999,1,0,BOONGATE
520425.0009,299374.9999,1,0,EASTLEIGH RD OUTSIDE NO 30 PETERBOROUGH
520425.0009,299724.9999,1,0,NORMAN RD 50M EAST OF SAXON RD PETERBOROUGH
520425.0009,300174.9999,1,0,BOWER CLOSE OS NO 3 PETERBOROUGH
520425.0009,300324.9999,1,0,C51 EASTFIELD RD JUNCTION DELAMERE CLOSE PETERBOROUGH
520425.0009,302274.9999,1,1,WELLAND RD NR JCTA47 PETERBOROUGH
520425.0009,302424.9999,1,0,A47 EYE RD JUNCTION A16 CROWLAND BYPASS PETERBOROUGH
520475.0009,260174.9999,1,0,CAMBRIDGE RD 500M NW OF JUNCTION A428
520475.0009,295424.9999,1,0,A605 STANHAM WAY EASTBOUND PETERBOROUGH
520475.0009,296324.9999,1,0,A605 WHITTLESEY RD 100M SOUTH OF B1091 PETERBOROUGH RD
520475.0009,296974.9999,1,0,CONEYGREE RD OUTSIDE NO 66 PETERBOROUGH
520475.0009,298974.9999,1,0,FRANK PERKINS PARKWAY A1139 AT JN WITH BOONGATE
520475.0009,299724.9999,1,0,ENTRANCE TO ST JOHN FISHER SCHOOL PARK LANE JNCT NORMAN RD
520475.0009,300424.9999,1,0,C51 EASTFIELD RD 30M SOUTH OF NEEWARK AVE PETERBOROUGH
520475.0009,300474.9999,1,0,EASTFIELD ROAD 5 METRES FROM JUNCTION WITH NEWARK AVENUE
520475.0009,300624.9999,1,0,EASTERN AVE OUTSIDE NO 9 PETERBOROUGH
520475.0009,300674.9999,1,0,EASTERN AVE JUNCTION SYCAMORE AVE PETERBOROUGH
520475.0009,301774.9999,1,0,SCALFORD DRIVE JUNCTION BELVOIR WAY PETERBOROUGH
520475.0009,302424.9999,1,0,A16 WELLAND ROAD
520525.0009,271374.9999,1,0,THRAPSTON ROAD B1514
520525.0009,298424.9999,1,1,FIRST DROVE 75M SOUTH OF FENGATE PETERBOROUGH
520525.0009,298474.9999,1,0,FENGATE AT JN WITH FIRST DROVE
520525.0009,299024.9999,1,1,BOONGATE RDABT A1139 SLIP RD ONTO RDABT BETWEEN SLIPS
520525.0009,299074.9999,1,0,FRANK PERKINS PARKWAY JNCT A1139 BOONGATE RDABT
520525.0009,299224.9999,1,0,PADHOLME RD  BANK RD PETERBOROUGH
520525.0009,300774.9999,1,0,OUTSIDE 31 EASTERN AVENUE
520525.0009,301274.9999,1,0,EASTERN AVE OUTSIDE 146 PETERBOROUGH
520575.0009,262924.9999,1,1,PAXTON HILL ST NEOTS
520575.0009,274624.9999,1,1,A14 EBC MP1164M OPPOSITE THE STUKELEYS
520575.0009,296324.9999,1,0,WHITTLESEY RD PELICAN CROSSING WEST OF OAKDALE AVE
520575.0009,296674.9999,1,1,DENTON RD PETERBOROUGH JUNCTION LAWSON AVENUE
520575.0009,296924.9999,1,0,LAWSON AVE JUNCTION WOODHURST RD STANGROUND
520575.0009,298474.9999,1,0,FENGATE JUNCTION NURSERY LANE PETERBOROUGH
520575.0009,298974.9999,1,0,BOONGATE FENGATE JUNCTION SLIP RD ONTO FRANK PERKINS
520575.0009,299074.9999,1,0,BOONGATE JUNCTION CARR RD PETERBOROUGH
520575.0009,299174.9999,1,0,FRANK PERKINS PARKWAY A1139 AT JN WITH BOONGATE
520575.0009,299424.9999,1,0,EASTFIELD RASEN COURT
520575.0009,300124.9999,1,0,REEVES WAY PETERBOROUGH  EXACT LOCATION UNKNOWN
520575.0009,300174.9999,1,0,REEVES WAY NR PETERBOROUGH CITY ACADEMY
520575.0009,301574.9999,1,0,HALLATON ROAD JUNCTION WITH REDMILE WALK
520625.0009,271474.9999,1,0,B1514 THRAPSTON RD JCT22 ONSLIP A14 WBC
520625.0009,271574.9999,1,0,B1514 THRAPSTON RD BRAMPTON
520625.0009,280524.9999,1,0,B1090 WOODWALTON LANE JUNCTION BRIDGE ST WOODWALTON
520625.0009,296274.9999,1,0,WHITTLESEY ROAD JN WITH OAKDALE AVENUE
520625.0009,298474.9999,1,0,FENGATE OUTSIDE PETERBOROUGH GREYHOUND STADIUM
520625.0009,298924.9999,1,0,BOONGATE
520625.0009,298974.9999,1,0,BOONGATE 50M SOUTH OF CARR ROAD PETERBOROUGH
520625.0009,299024.9999,1,0,CARR ROAD
520625.0009,299174.9999,1,0,PADHOLME ROAD EAST JUNCTION  CARR ROAD PETERBOROUGH
520625.0009,299274.9999,1,0,A1139  FRANK PERKINS PARKWAY JUNCTION WITH BOONGATE ON SLIP
520675.0009,271524.9999,1,0,JUNCTION 22 A14 EASTBOUND
520675.0009,274924.9999,1,1,LOW ROAD
520675.0009,280424.9999,1,0,WALTON HILL B1090 100 METRES SOUTH OF JUNCTION WITH BRIDGE S
520675.0009,296274.9999,1,1,A605 WHITTLSEY RD OS SOUTHFIELDS JUNIOR SCHOOL PETERBOROUGH
520675.0009,296974.9999,1,0,CONEYGREE RD JUNCTION THISTLE DRIVE PETERBOROUGH
520675.0009,299224.9999,1,0,OUTSIDE MCDONALDS PADHOLME ROAD EAST AT JN WITH CARR ROAD
520675.0009,299274.9999,1,1,CARR ROAD 50M NORTH OF PADHOLME ROAD JUNCTION
520675.0009,299324.9999,1,0,A1139 FRANK PERKINS PARKWAY JUNCTION BOONGATE ON SLIP
520675.0009,301424.9999,1,0,STATHERN ROAD TURNING TO BUCKMINSTER PLACE
520725.0009,259874.9999,1,0,ST NEOTS BY-PASS A428 200 METRES CAMBRIDGE ROAD B1428
520725.0009,267374.9999,1,0,MILL RD OUTSIDE 123 BUCKDEN
520725.0009,271324.9999,1,0,THRAPSTON ROAD BRAMPTON
520725.0009,296274.9999,1,0,A605 WHITTLESEY RD JUNCTION SYDNEY RD PETERBOROUGH
520725.0009,298874.9999,1,1,BOONGATE JUNCTION MALLORY RD PETERBOROUGH
520725.0009,299574.9999,1,0,A1139 FLETTON PWAY NO GRID REF GIVEN EXACT LOC NOT KNOWN
520725.0009,299624.9999,1,0,A1139 FRANK PERKINS 400M NORTH BOONGATE SLIP OFF PETERBOROUG
520725.0009,300224.9999,1,0,REEVES WAY JUNCTION VINNEY CLOSE PETERBOROUGH
520775.0009,259874.9999,1,0,A428 ST NEOTS BYPASS 200M SW OF CAMBRIDGE RD
520775.0009,271574.9999,1,0,A14 EASTBOUND EXACT LOCATION UNCLEAR PLOTTED FROM DIAGRAM IN
520775.0009,274374.9999,1,1,A14 EBC 2000M NW OF JCT 23
520775.0009,296524.9999,1,0,SOUTHFIELDS DRIVE PETERBOROUGH  EXACT LOCATION UNKNOWN
520775.0009,296624.9999,1,0,SOUTHFIELDS DRIVE JUNCTION LAWSON AVE PETERBOROUGH
520775.0009,300474.9999,1,0,REEVES WAY JUNCTION HILL CLOSE PETERBOROUGH
520825.0009,263574.9999,1,0,HIGH ST GREAT PAXTON AT BUS STOP
520825.0009,296274.9999,1,0,WHITTLESEY ROAD AT JN WITH DESBOROUGH AVENUE
520825.0009,296724.9999,1,0,SOUTHFIELDS DRIVE JUNCTION SHELTON RD PETERBOROUGH
520825.0009,296824.9999,1,0,SOUTHFIELDS DRIVE JUNCTION WINDSOR DRIVE
520825.0009,298674.9999,1,0,FORTY ACRE ROAD PETERBOROUGH  AT WICKES
520825.0009,300474.9999,1,1,REEVES WAY PETERBOROUGH
520825.0009,300524.9999,1,0,C51 EASTFIELD RD JUNCTION FOOTPATH SHERBORNE RD HILL CLOSE
520875.0009,271124.9999,1,0,GROVE LANE AT JN WITH MILLER WAY B1514
520875.0009,296274.9999,1,0,ROMANY GARDENS 50M N OF A605 WHITTLESEY RD PETERBOROUGH
520875.0009,296874.9999,1,0,CONEYGREE RD 10M SOUTHFIELDS DRIVE PETERBOROUGH
520875.0009,298474.9999,1,0,C65 FENGATE JUNCTION SECOND DROVE PETERBOROUGH
520875.0009,298674.9999,1,0,FORTY ACRE RD NR BOONGATE PETERBOROUGH
520875.0009,298774.9999,1,0,BOONGATE  50 METRES NORTH OF JUNCTION WITH FORTY ACRE
520875.0009,302324.9999,1,0,EYE ROAD A47 400 METRES WEST OF JUNCTION WITH WELLAND ROAD
520925.0009,270974.9999,1,0,HORSESHOES WAY 10M SW OF HIGH ST BRAMPTON
520925.0009,271024.9999,1,0,HIGH ST OPP TO SHOP 101 BRAMPTON
520925.0009,271224.9999,1,0,B1514 THRAPSTON RD JUNCTION GROVE LANE BRAMPTON
520925.0009,274224.9999,1,1,A14 EASTBOUND NEAR JUNCTION 23 HUNTINGDON
520925.0009,294374.9999,1,0,C88 STRAIGHT DROVE JUNCTION C87 KINGS DELPH DROVE
520925.0009,295374.9999,1,0,A605 STANGROUND BY PASS EB 250M WEST RDABT TO CARDIA
520925.0009,300274.9999,1,0,FRANK PERKINS PARKWAY A1139 SOUTH OF JUNCTION WITH EASTFIELD
520925.0009,301624.9999,1,1,A15 PASTON PARKWAY PETERBOROUGH
520975.0009,263874.9999,1,0,B1043 HIGH ST OUTSIDE NO 57 GREAT PAXTON
520975.0009,271624.9999,1,0,A14 EASTBOUND ON BRAMPTON RACE COURSE
520975.0009,298674.9999,1,0,BOONGATE 125M NORTH OF FENGATE
520975.0009,298724.9999,1,1,BOONGATE 20M SOUTH OF NEWARK RD PETERBOROUGH
520975.0009,300324.9999,1,0,A1139 FRANK PERKINS PARKWAY WB AT SLIP ON FROM OXNEY RD
520975.0009,300474.9999,1,0,C51 OXNEY RD  WEST OF FRANKLIN CRESCENT PETERBOROUGH
520975.0009,300574.9999,1,0,C51 EYE RD SLIP RD FROM EASTFIELD RD PETERBOROUGH
520975.0009,301574.9999,1,0,A15 PASTON PARKWAY 300M W OF A1139 EYE RAB PETERBOROUGH
521025.0009,271174.9999,1,0,B1514 THRAPSTON RD 25M WEST OF ORCHARD LANE BRAMPTON
521025.0009,294424.9999,1,0,KINGS DELPH RD 100M NE OF STRAIGHT DROVE FACET
521025.0009,295924.9999,1,0,OAKDALE AVE JW WRIGHT AVE PETERBOROUGH
521025.0009,296574.9999,1,0,LAWSON AVE 20M EAST OF ST GEORGES AVE PETERBOROUGH
521025.0009,298524.9999,1,0,FENGATE RD JUNCTION BOONGATE FENGATE
521025.0009,299224.9999,1,0,PADHOLME ROAD EAST UNSPECIFIED ROAD OR LOCATION VICARAGE FAR
521025.0009,300424.9999,1,0,C64 SLIP RD TO A1139 JUNCTION 7 OXNEY RD PETERBOROUGH
521025.0009,300474.9999,1,0,FRANK PERKINS PARKWAY A1139 EASTFIELD ROAD
521025.0009,300774.9999,1,0,EYE ROAD SWAN GARDENS
521025.0009,300824.9999,1,0,C51 EYE RD JUNCTION BURFORD WAY PETERBOROUGH
521025.0009,302974.9999,1,0,A16 800M NORTH OF A47 PETERBOROUGH
521075.0009,273974.9999,1,0,A14 HUNTINGDON
521075.0009,295624.9999,1,0,JUPITER AVE 20M WEST OF MORRISONS ROUNDABOUT PETERBOROUGH
521075.0009,300824.9999,1,0,EYE RD JUNCTION BURFORD WAY PETERBOROUGH
521075.0009,301574.9999,1,0,PASTON PARKWAY A15 NEAR JN WITH FRANK PERKINS PARKWAY A1139
521125.0009,271124.9999,1,0,THRAPSTON RD ACCESS RD TO NO 66 HUNTINGDON
521125.0009,281424.9999,1,0,NEW RD HUNTINGDON  EXACT LOC NOT KNOWN NO GRID REF GIVEN
521125.0009,296924.9999,1,0,FIELDFARE DRIVE
521125.0009,300974.9999,1,0,EYE RD PETERBOROUGH  EXACT LOC UNKNOWN
521125.0009,303174.9999,1,0,A16 NEWBOROUGH BY PASS 1000M NORTH OF A47 PETERBOROUGH
521175.0009,264274.9999,1,1,B1043 HIGH STREET OUTSIDE NO 104 GREAT PAXTON
521175.0009,295424.9999,1,1,A605 EASTBOUND 10M W OF CARDEA ROUNDABOUT PETERBOROUGH
521175.0009,296724.9999,1,0,CONEYGREE RD OUTSIDE 163 165 PETERBOROUGH
521175.0009,298824.9999,1,0,NEWARK RD JUNCTION BRITISH CAR AUCTION PETERBOROUGH
521175.0009,299224.9999,1,0,PADHOLME RD EAST JUNCTION JET GARAGE PETERBOROUGH
521175.0009,300474.9999,1,0,OXNEY RD ROUNDABOUT PETERBOROUGH
521175.0009,300774.9999,1,0,A1139 PETERBOROUGH
521175.0009,301374.9999,1,0,BELVOIR WAY AT JN WITH EYE ROAD
521175.0009,301574.9999,1,0,A15 PASTON PARKWAY 200M WEST OF A1139 EYE ROUNDABOUT
521175.0009,303224.9999,1,0,A16 PETERBOROUGH
521225.0009,270074.9999,1,0,C340 BUCKDEN RD OS FROSTS GARDEN CENTRE BRAMPTON
521225.0009,295424.9999,1,0,A605 APOLLO AVENUE
521225.0009,295674.9999,1,0,MORRISONS SUPERMARKET BELLONA DRIVE
521225.0009,296224.9999,1,0,A605 WHITTLESEY RD 20M KINGSTON DRIVE PETERBOROUGH
521225.0009,296724.9999,1,0,CONEYGREE RD OS 200 PETERBOROUGH
521225.0009,298624.9999,1,1,FENGATE JUNCTION WHITEHEAD DROVE FENGATE
521225.0009,299224.9999,1,0,PADHOLME RD EAST OS CATERFIX COOK HOUSE PETERBOROUGH
521225.0009,299374.9999,1,0,VICARAGE FARM RD JUNCTION THE MANOR GROVE CENTRE PBORO
521225.0009,303324.9999,1,1,A16 1200M N OF A47
521275.0009,273774.9999,1,1,A14 EASTBOUND 1200M WEST OF SPITTALS RDABT THE STUKELEYS
521275.0009,296624.9999,1,0,CONEYGREE RD OS 195 JNCT ELLWOODS AVE PETERBOROUGH
521275.0009,298924.9999,1,0,NEWARK RD 300M SOUTH OF PADHOLME RD EAST PETERBOROUGH
521275.0009,298974.9999,1,0,NEWARK RD 300M SOUTH OF PADHOLME RD EAST PETERBOROUGH
521275.0009,300524.9999,1,1,C64 OXNEY ROAD PETERBOROUGH NO GRID REF OR DIR GIVEN
521375.0009,264924.9999,1,0,B1043 PAXTON RD OFFORD DARCY
521375.0009,270124.9999,1,0,OUTSIDE 1A RIVER LANE BRAMPTON
521375.0009,270274.9999,1,0,C340 BUCKDEN RD JCT SAINT GEORGES CLOSE DIR OF TRAVEL UK
521375.0009,271874.9999,1,0,A14 2000M EAST OF A1 BRAMPTON HUT HUNTINGDON
521375.0009,294574.9999,1,0,C87 KINGS DELPH RD FARCET  EXACT LOC NOT KNOWN NO GRID REF
521375.0009,296174.9999,1,0,HORSEY WAY SERVICES WHITTLESEY ROAD B1092 NEAR JN WITH CONEY
521375.0009,301324.9999,1,0,FRANK PERKINS PARKWAY A1139 SLIP ROAD JUNCTION SOUTH OF EYE
521425.0009,270624.9999,1,0,B1514 CHURCH ROAD JNCT BUCKDEN RD AND HIGH ST BRAMPTON
521425.0009,273574.9999,1,0,A14 EBC ALCONBURY 1000M WEST OF A14 EBC SPITTALS
521425.0009,280074.9999,1,0,B1090
521425.0009,296174.9999,1,0,WHITTLESEY RD 5M CONEYGREE RD PETERBOROUGH
521425.0009,299224.9999,1,0,NEWARK ROAD AT LEFT HAND BEND BEFORE ROUNDABOUT WITH PADHOLM
521425.0009,300374.9999,1,0,NEWARK ROAD EXACT LOCATION NOT KNOWN NO GRID REF PROVIDED
521425.0009,300524.9999,1,1,OXNEY ROAD UNSPECIFIED ROAD OR LOCATION NEWARK ROAD
521425.0009,301874.9999,1,0,A1139 EYE RD 250M EAST OF A1139 JUNCTION 8 PETERBOROUGH
521475.0009,270724.9999,1,0,CHURCH ROAD 250 METRES SOUTH OF JUNCTION WITH THRAPSTON ROAD
521475.0009,299324.9999,1,0,NEWARK RD 150M N OF PADHOLME RD EAST PETERBOROUGH
521475.0009,303574.9999,1,1,A16 BY PASS 500M NORTH IRON BRIDGE PETERBOROUGH
521525.0009,260024.9999,1,1,A428 ST NEOTS EXACT LOCATION UNKNOWN
521525.0009,271974.9999,1,0,A14 WESTBOUND CWAY J23 TO J22 HUNTINGDON
521525.0009,299024.9999,1,0,STOREYS BAR RD JUNCTION PADHOLME RD EAST PETERBOROUGH
521525.0009,299474.9999,1,0,NEWARK RD JUNCTION ENTERPRISE HIRE COMPANY
521575.0009,270974.9999,1,0,B1514 HUNTINGDON RD JUNCTION CHURCH RD
521575.0009,273374.9999,1,0,EAST BOUND A14  WEST OF JUNCTION WITH SPITTALS JUNCTION 23 I
521575.0009,296624.9999,1,1,RAMSEY WAY JUNCTION ELLWOOD AVENUE STANGROUND
521575.0009,299024.9999,1,0,C65 FENGATE JUNCTION STOREYS BAR ROAD PETERBOROUGH
521575.0009,300974.9999,1,0,SALTERSGATE 40M EAST OF WHITACRE PETERBOROUGH
521575.0009,301574.9999,1,0,A15 PARNWELL WAY 200M EAST OF A1139 PETERBOROUGH
521575.0009,302024.9999,1,1,EYE ROAD A1139
521575.0009,306074.9999,1,0,B1443 THORNEY RD PETERBOROUGH  NEAR WHITE POST ROAD
521625.0009,251824.9999,1,1,DROVE RD 200M NORTH OF HEATH RD GAMLINGAY
521625.0009,260024.9999,1,0,CAMBRIDGE ROAD A428 700 METRES EAST OF JUNCTION WITH CAMBRID
521625.0009,272074.9999,1,0,A14 EASTBOUND 900M WEST OF JNCT 23 SPITTALS INTERCHANGE
521625.0009,279824.9999,1,1,B1090 300M NORTH OF LINDEN HOUSE WOODWALTON
521625.0009,299174.9999,1,0,STOREYS BAR RD NR POWER STATION PETERBOROUGH
521625.0009,299524.9999,1,0,NEWARK RD JUNCTION VICARAGE FARM RD PETERBOROUGH   NO DIRECT
521625.0009,300424.9999,1,0,OUTSIDE NUMBER 158 MEADENVALE
521625.0009,300674.9999,1,0,OXNEY RD 10M SOUTH OF PARNWELL WAY PETERBOROUGH
521675.0009,273324.9999,1,0,HALF A MILE BEFORE EXIT SLIP SPITTALS A14
521675.0009,301024.9999,1,0,"53 SALTERS  GATE, PETERBOROUGH"
521725.0009,296224.9999,1,0,PORTCHESTER CLOSE AT JUNCTION WITH PARK FARM ROAD
521725.0009,296624.9999,1,0,KEDLESTON RD STANGROUND OS NO 24 PETERBOROUGH
521725.0009,299374.9999,1,0,C65 STOREYS BAR RD OUTSIDE VW SHOWROOM PETERBOROUGH
521725.0009,301324.9999,1,0,ST MICHAELS GATE OS NO 56 PETERBOROUGH
521725.0009,302624.9999,1,0,A1139 EYE RDABOUT JUNCTION A47 EYE
521775.0009,257174.9999,1,0,ST NEOTS ROAD B1046
521775.0009,272424.9999,1,0,A14 500M WEST OF SPITTALS LINK ROUNDABOUT HUNTINGDON
521775.0009,273224.9999,1,0,A14 450M NORTH OF JUNCTION 23 SPITTALS INTERCHANGE HUNTINGDO
521775.0009,274824.9999,1,0,ERMINE STREET AT JN WITH CHURCH ROAD
521775.0009,279474.9999,1,0,STATION ROAD B1090
521775.0009,300324.9999,1,0,EDGERLEY PRAIN ROAD 50M NORTH OF PALMERS ROAD
521775.0009,300374.9999,1,0,EDGERLEY DRAIN RD FENGATE PETERBOROUGH  AT NO 4
521775.0009,300574.9999,1,0,OXNEY RD JUNCTION EDGERLEY DRAIN RD PETERBOROUGH
521775.0009,300924.9999,1,0,STAPLEE RD 20M PARNWELL WAY PETERBOROUGH
521775.0009,300974.9999,1,0,PARNWELL WAY JUNCTION STAPLEE WAY PETERBOROUGH
521775.0009,306024.9999,1,0,THORNEY ROAD B1443 WHITEPOST ROAD
521825.0009,265874.9999,1,0,B1043 HIGH ST 30M SOUTH OF ORCHARD WAY ST NEOTS
521825.0009,272174.9999,1,0,WOODLANDS JUNCTION THE SHRUBBERY HUNTINGDON
521825.0009,272474.9999,1,0,A14 EBC  500M WEST JNCT 23
521825.0009,273174.9999,1,1,A14 SBC 100M PRIOR TO JUNCTION 23 HUNTINGDON
521825.0009,296074.9999,1,0,WHITTLESEY ROAD A605
521825.0009,301174.9999,1,1,PARNWELL WAY NR TO TESCO DISTRIBUTION CENTRE
521825.0009,302474.9999,1,0,PETERBOROUGH RD PETERBOROUGH AT ENTRANCE TO FIELD
521825.0009,302574.9999,1,0,A1139 EYE VILLAGE 100M EAST OF A47 MAIN RDABT PETERBOROUGH
521875.0009,259924.9999,1,1,A428  NEAR LAYBY PLOTTED AT GRID REF PROVIDED
521875.0009,296174.9999,1,0,FRAMLINGHAM RD OUTSIDE NO 20 PETERBOROUGH
521925.0009,259924.9999,1,1,A428 CAMBRIDGE RD OUTSIDE WINTRINGHAM HALL ST NEOTS
521925.0009,266374.9999,1,0,HIGH STREET B1043 GRAVELEY ROAD NR PADDOCKS
521925.0009,266474.9999,1,0,OUTSIDE HOUSE NUMBER 75 HIGH STREET B1043
521925.0009,267124.9999,1,0,STATION LANE JUNCTION B1043 OFFORD CLUNY ST NEOTS
521975.0009,266824.9999,1,1,OUTSIDE OLD SCHOOL HOUSE HIGH STREET B1043
521975.0009,267224.9999,1,0,B1043 HIGH ST OFFORD CLUNY  JW OPEFORD CLOSE
521975.0009,273074.9999,1,0,ON SLIP ROAD AT J23 SPITTLES ROUNDABOUT A14
521975.0009,296024.9999,1,0,A605 STANGROUND WHITTLESEY SIDE OF RDABT
521975.0009,296074.9999,1,0,A605 WHITTLESEY RD JUNCTION A605 CARIDA STANGROUND
522025.0009,272024.9999,1,0,CHRISTIE DRIVE EXACT LOCATION UNKNOWN
522025.0009,272774.9999,1,0,A14 WEST OS MARRIOTT HOTEL HUNTINGDON
522025.0009,272824.9999,1,0,A14 SPITTALS HUNTINGDON
522025.0009,273024.9999,1,0,A14 1850M WEST OF A141 HUNTINGDON R/A
522025.0009,296024.9999,1,0,B1095 MILK AND WATER DROVE JUNCTION A605 WHITTLESEY
522075.0009,267474.9999,1,0,B1043 HIGH ST OUTSIDE NO 218 OFFORD DARCY
522075.0009,272874.9999,1,0,A14 SPITTAL JNCT 23 NR MARRIOT HOTEL EXACT LOC UNCLEAR
522075.0009,300424.9999,1,1,C64 OXNEY RD 300M WEST OF PEARCES RD PETERBOROUGH
522075.0009,302424.9999,1,0,C338 PETERBOROUGH RD EYE  EXACT LOCATION UNKNOWN
522125.0009,252674.9999,1,0,DROVE RD THREE QUARTER MILE N OF HEATH RD GAMLINGAY
522125.0009,272874.9999,1,0,UNDER SPITTALS INTERCHANGE J23 HUNTINGDON A14
522125.0009,272924.9999,1,0,A14 JUNCTION 23
522125.0009,295724.9999,1,0,B1095 RAMSEY RD 300M SOUTH OF A605 TOLL RD PETERBOROUGH
522125.0009,300424.9999,1,0,C64 OXNEY RD 200M WEST OF PEARCES RD AT RHB
522125.0009,300474.9999,1,0,OXNEY RD TWDS PETERBOROUGH NR LORRY YARD
522125.0009,302774.9999,1,0,GEORGE MATTHEWS GARDENS EYE
522175.0009,290174.9999,1,0,"NEW LONG DROVE AT JN WITH UNNAMED, 650M EAST OF BLACK HAM DR"
522175.0009,299374.9999,1,0,STOREYS BAR RD 400M EAST OF EDGERLEY DRAIN RD PETERBOROUGH
522175.0009,305874.9999,1,0,A16 WHITEPOST RD 100M SOUTH OF B1443 THORNEY RD PETERBOROUGH
522175.0009,305924.9999,1,0,A16 30M B1443 PETERBOROUGH APPROACHING ROUNDABOUT
522175.0009,305974.9999,1,0,A16 JUNCTION B1443 PETERBOROUGH
522225.0009,272874.9999,1,0,A14 SPITTALS RDABT JNCT 23 SLIP RD TO EBC HUNTINGDON
522225.0009,299374.9999,1,1,STOREYS BAR RD 480M EAST OF EDGERLEY DRAIN
522225.0009,305924.9999,1,0,A16 SOUTHBOUND WEST OF B1443 THORNEY RD PETERBOROUGH
522225.0009,306024.9999,1,0,A16 NEAR JN WITH THORNEY ROAD B1443
522225.0009,306074.9999,1,0,A16 100M NORTH OF B1443 PETERBOROUGH
522225.0009,306124.9999,1,0,A16 150M NORTH OF B1443 PETERBOROUGH
522275.0009,272774.9999,1,0,73 WESTBOUND CARRIAGEWAY A14 100 METRES EAST OF JUNCTION WIT
522275.0009,272824.9999,1,0,A14 EBC 100M EAST OF SPITTALS INTERCHANGE HUNTINGDON
522275.0009,278324.9999,1,0,B1090 JUNCTION CLAY LANE HUNTINGDON
522275.0009,294974.9999,1,0,B1095 KINGS DELPH DROVE JUNCTION C87 RAMSEY RD PETERBOROUGH
522275.0009,295024.9999,1,0,B1095 10M KINGS DELPH DROVE FACET
522325.0009,271024.9999,1,0,B1514 HUNTINGDON RD 100M SW OF BROMHOLME LANE BRAMPTON
522325.0009,272324.9999,1,0,PARKWAY HUNTINGDON
522325.0009,272774.9999,1,0,A14 EASTBOUND NEAR SPITTALS HUNTINGDON
522325.0009,274224.9999,1,0,ERMINE STREET NEAR JN WITH GREEN END
522325.0009,294774.9999,1,1,FISH FLOAT FARM RAMSEY ROAD B1095
522325.0009,302974.9999,1,0,A16
